{
  "city_id": "tokyo/shinagawa",
  "city_name_ja": "品川区",
  "source_url": "https://www.city.shinagawa.tokyo.jp/PC/kankyo/kankyo-gomi/",
  "areas": [
    {
      "area_id": "1-chome",
      "area_name_ja": "勝島1丁目",
      "categories": [
        {
          "category_id": "burnable",
          "name_ja": "燃やすごみ",
          "collection_days": {
            "type": "weekly",
            "days": [
              "tuesday",
              "friday"
            ]
          }
        },
        {
          "category_id": "non-burnable",
          "name_ja": "陶器・ガラス・金属ごみ",
          "collection_days": {
            "type": "monthly",
            "pattern": [
              {
                "week": 2,
                "day": "monday"
              },
              {
                "week": 4,
                "day": "monday"
              }
            ]
          }
        },
        {
          "category_id": "recyclable",
          "name_ja": "資源",
          "collection_days": {
            "type": "weekly",
            "days": [
              "saturday"
            ]
          }
        }
      ]
    },
    {
      "area_id": "2-chome",
      "area_name_ja": "勝島2丁目",
      "categories": [
        {
          "category_id": "burnable",
          "name_ja": "燃やすごみ",
          "collection_days": {
            "type": "weekly",
            "days": [
              "tuesday",
              "friday"
            ]
          }
        },
        {
          "category_id": "non-burnable",
          "name_ja": "陶器・ガラス・金属ごみ",
          "collection_days": {
            "type": "monthly",
            "pattern": [
              {
                "week": 2,
                "day": "wednesday"
              },
              {
                "week": 4,
                "day": "wednesday"
              }
            ]
          }
        },
        {
          "category_id": "recyclable",
          "name_ja": "資源",
          "collection_days": {
            "type": "weekly",
            "days": [
              "tuesday"
            ]
          }
        }
      ]
    },
    {
      "area_id": "2-chome4-4",
      "area_name_ja": "平塚2丁目4番4号",
      "categories": [
        {
          "category_id": "burnable",
          "name_ja": "燃やすごみ",
          "collection_days": {
            "type": "weekly",
            "days": [
              "monday",
              "thursday"
            ]
          }
        },
        {
          "category_id": "non-burnable",
          "name_ja": "陶器・ガラス・金属ごみ",
          "collection_days": {
            "type": "monthly",
            "pattern": [
              {
                "week": 2,
                "day": "thursday"
              },
              {
                "week": 4,
                "day": "thursday"
              }
            ]
          }
        },
        {
          "category_id": "recyclable",
          "name_ja": "資源",
          "collection_days": {
            "type": "weekly",
            "days": [
              "monday"
            ]
          }
        }
      ]
    },
    {
      "area_id": "3-chome",
      "area_name_ja": "勝島3丁目",
      "categories": [
        {
          "category_id": "burnable",
          "name_ja": "燃やすごみ",
          "collection_days": {
            "type": "weekly",
            "days": [
              "tuesday",
              "friday"
            ]
          }
        },
        {
          "category_id": "non-burnable",
          "name_ja": "陶器・ガラス・金属ごみ",
          "collection_days": {
            "type": "monthly",
            "pattern": [
              {
                "week": 2,
                "day": "monday"
              },
              {
                "week": 4,
                "day": "monday"
              }
            ]
          }
        },
        {
          "category_id": "recyclable",
          "name_ja": "資源",
          "collection_days": {
            "type": "weekly",
            "days": [
              "saturday"
            ]
          }
        }
      ]
    },
    {
      "area_id": "4-chome",
      "area_name_ja": "西大井4丁目",
      "categories": [
        {
          "category_id": "burnable",
          "name_ja": "燃やすごみ",
          "collection_days": {
            "type": "weekly",
            "days": [
              "tuesday",
              "friday"
            ]
          }
        },
        {
          "category_id": "non-burnable",
          "name_ja": "陶器・ガラス・金属ごみ",
          "collection_days": {
            "type": "monthly",
            "pattern": [
              {
                "week": 1,
                "day": "thursday"
              },
              {
                "week": 3,
                "day": "thursday"
              }
            ]
          }
        },
        {
          "category_id": "recyclable",
          "name_ja": "資源",
          "collection_days": {
            "type": "weekly",
            "days": [
              "wednesday"
            ]
          }
        }
      ]
    },
    {
      "area_id": "5-chome",
      "area_name_ja": "西大井5丁目",
      "categories": [
        {
          "category_id": "burnable",
          "name_ja": "燃やすごみ",
          "collection_days": {
            "type": "weekly",
            "days": [
              "tuesday",
              "friday"
            ]
          }
        },
        {
          "category_id": "non-burnable",
          "name_ja": "陶器・ガラス・金属ごみ",
          "collection_days": {
            "type": "monthly",
            "pattern": [
              {
                "week": 1,
                "day": "thursday"
              },
              {
                "week": 3,
                "day": "thursday"
              }
            ]
          }
        },
        {
          "category_id": "recyclable",
          "name_ja": "資源",
          "collection_days": {
            "type": "weekly",
            "days": [
              "wednesday"
            ]
          }
        }
      ]
    },
    {
      "area_id": "5-chome1-10",
      "area_name_ja": "東大井5丁目1～10番",
      "categories": [
        {
          "category_id": "burnable",
          "name_ja": "燃やすごみ",
          "collection_days": {
            "type": "weekly",
            "days": [
              "wednesday",
              "saturday"
            ]
          }
        },
        {
          "category_id": "non-burnable",
          "name_ja": "陶器・ガラス・金属ごみ",
          "collection_days": {
            "type": "monthly",
            "pattern": [
              {
                "week": 2,
                "day": "friday"
              },
              {
                "week": 4,
                "day": "friday"
              }
            ]
          }
        },
        {
          "category_id": "recyclable",
          "name_ja": "資源",
          "collection_days": {
            "type": "weekly",
            "days": [
              "thursday"
            ]
          }
        }
      ]
    },
    {
      "area_id": "5-chome1-39",
      "area_name_ja": "八潮5丁目1～39号",
      "categories": [
        {
          "category_id": "burnable",
          "name_ja": "燃やすごみ",
          "collection_days": {
            "type": "weekly",
            "days": [
              "monday",
              "wednesday",
              "friday"
            ]
          }
        },
        {
          "category_id": "non-burnable",
          "name_ja": "陶器・ガラス・金属ごみ",
          "collection_days": {
            "type": "monthly",
            "pattern": [
              {
                "week": 1,
                "day": "saturday"
              },
              {
                "week": 3,
                "day": "saturday"
              }
            ]
          }
        },
        {
          "category_id": "recyclable",
          "name_ja": "資源",
          "collection_days": {
            "type": "weekly",
            "days": [
              "monday"
            ]
          }
        }
      ]
    },
    {
      "area_id": "5-chome40-69",
      "area_name_ja": "八潮5丁目40～69号棟・わかくさ荘",
      "categories": [
        {
          "category_id": "burnable",
          "name_ja": "燃やすごみ",
          "collection_days": {
            "type": "weekly",
            "days": [
              "tuesday",
              "thursday",
              "saturday"
            ]
          }
        },
        {
          "category_id": "non-burnable",
          "name_ja": "陶器・ガラス・金属ごみ",
          "collection_days": {
            "type": "monthly",
            "pattern": [
              {
                "week": 2,
                "day": "saturday"
              },
              {
                "week": 4,
                "day": "saturday"
              }
            ]
          }
        },
        {
          "category_id": "recyclable",
          "name_ja": "資源",
          "collection_days": {
            "type": "weekly",
            "days": [
              "monday"
            ]
          }
        }
      ]
    },
    {
      "area_id": "6-chome",
      "area_name_ja": "西大井6丁目（荏原エリア）",
      "categories": [
        {
          "category_id": "burnable",
          "name_ja": "燃やすごみ",
          "collection_days": {
            "type": "weekly",
            "days": [
              "wednesday",
              "saturday"
            ]
          }
        },
        {
          "category_id": "non-burnable",
          "name_ja": "陶器・ガラス・金属ごみ",
          "collection_days": {
            "type": "monthly",
            "pattern": [
              {
                "week": 2,
                "day": "monday"
              },
              {
                "week": 4,
                "day": "monday"
              }
            ]
          }
        },
        {
          "category_id": "recyclable",
          "name_ja": "資源",
          "collection_days": {
            "type": "weekly",
            "days": [
              "thursday"
            ]
          }
        }
      ]
    },
    {
      "area_id": "6-chome1-16",
      "area_name_ja": "東大井6丁目1～16番",
      "categories": [